[
  {
    "participant_id": "P09",
    "task_type": "lab_website",
    "step_index": 0,
    "decision_and_actions": "The designer created a new frame in Figma named 'MacBook Air - 1' to begin designing the laboratory website wireframe. This frame is based on the MacBook Air's display dimensions, which the designer is most familiar with.",
    "rationale": "",
    "progression": "By establishing a frame based on the MacBook Air, the designer set a clear foundation for the wireframe, allowing them to focus on the primary design elements without the immediate complexity of responsive design. This approach enables a more straightforward development of the initial layout, which can later be adapted for other devices."
  },
  {
    "participant_id": "P09",
    "task_type": "lab_website",
    "step_index": 1,
    "decision_and_actions": "The designer decided to place a placeholder for the lab logo in the top-left corner of the web interface. They created a text element labeled '로고' to represent the logo. Additionally, they chose to display the menu bar openly rather than using a hamburger button, which is more common in mobile interfaces.",
    "rationale": "The decision to place the logo in the top-left corner is based on common web design practices, making it intuitive for users to locate. The designer believes that an openly displayed menu bar enhances accessibility on larger screens, as it avoids the need for users to click a hamburger button to access menu options.",
    "progression": "The design process began with establishing a familiar layout by positioning the logo in a conventional spot. This was followed by enhancing user accessibility by opting for a visible menu bar, which aligns with the designer's preference for desktop interfaces. These steps set the foundation for a user-friendly and accessible web interface."
  },
  {
    "participant_id": "P09",
    "task_type": "lab_website",
    "step_index": 2,
    "decision_and_actions": "The designer decided to include an 'Our Mission' section on the research lab's website. They changed the text from Korean to English, updating the name and characters of the text element to 'Our Mission'. Additionally, they adjusted the width of the text element from 37 to 112 to accommodate the new text.",
    "rationale": "The rationale behind including an 'Our Mission' section is to provide visitors with a clear understanding of the lab's purpose and goals. This is particularly important for potential researchers, collaborators, and prospective students who are interested in the lab's activities and objectives. By presenting this information prominently, the designer aims to engage and inform the audience effectively.",
    "progression": "The design process progressed by first identifying the key sections that should be included on the website to cater to the target audience's needs. The designer then implemented these sections, starting with 'Our Mission', ensuring that the text is clear and appropriately sized for visibility. This step is part of a broader strategy to structure the website in a way that communicates essential information about the lab efficiently."
  },
  {
    "participant_id": "P09",
    "task_type": "lab_website",
    "step_index": 3,
    "decision_and_actions": "The designer decided to emphasize the 'Projects' section on the research lab's website. They changed the text label from '로고' to 'Projects' and adjusted the width of the text element from 37 to 77 to accommodate the new label. This change was made in the navigation bar to ensure 'Projects' is prominently displayed.",
    "rationale": "The rationale behind emphasizing 'Projects' over 'Research' or 'News' is that the lab's projects, such as design awards and external assignments, are more likely to capture the interest of external visitors. The designer believes that showcasing these projects prominently will make the website more engaging and informative for its audience.",
    "progression": "By placing 'Projects' prominently in the navigation bar, the designer set the stage for a website that highlights the lab's achievements and ongoing work. This decision logically follows the goal of making the website appealing to external visitors by showcasing the lab's most interesting and impactful work first. The designer plans to ensure that the 'Research' section is also highlighted effectively, but in a way that complements the emphasis on projects."
  },
  {
    "participant_id": "P09",
    "task_type": "lab_website",
    "step_index": 4,
    "decision_and_actions": "The designer added 'Research' and 'News' sections to the navigation bar of the lab's website. The text for 'Research' was changed from Korean to English, and its width was adjusted from 37 to 88. Similarly, the 'News' section was added, changing the text from Korean to English and adjusting its width from 37 to 54.",
    "rationale": "The inclusion of 'Research' and 'News' sections was based on the common structure of lab websites, rather than any unique purpose. These sections are standard and expected components that provide essential information about the lab's activities and updates.",
    "progression": "The design process progressed by enhancing the navigation bar to include key sections that align with typical lab website structures. This step ensures that users can easily access important information about the lab's research activities and news updates, thereby improving the website's functionality and user experience."
  },
  {
    "participant_id": "P09",
    "task_type": "lab_website",
    "step_index": 5,
    "decision_and_actions": "The designer changed the navigation menu item from 'News' to 'Members'. This involved updating the text and adjusting the width of the menu item to accommodate the new label.",
    "rationale": "",
    "progression": "By adding the 'Members' section, the designer completed the main structure of the website's navigation. This decision ensured that all essential sections were represented, aligning with the goal of providing a complete overview of the lab's activities and personnel."
  },
  {
    "participant_id": "P09",
    "task_type": "lab_website",
    "step_index": 6,
    "decision_and_actions": "The designer decided to reduce the overall size of the text elements on the web interface to create a more polished look. Specifically, the font size of several text elements, including 'Our Mission', 'Projects', 'Research', 'News', and 'Members', was decreased from 20 to 14. Additionally, the width and height of these elements were adjusted accordingly. The designer also modified the spacing between these elements by changing the item spacing from 64 to 40, which resulted in a more compact layout.",
    "rationale": "",
    "progression": "The design process progressed logically by first addressing the size and spacing of the text elements to enhance the overall aesthetic of the website. By making these adjustments, the designer ensured that the layout was not only visually balanced but also aligned with the typical structure of research lab websites. This step set the foundation for further refinements and additions to the web interface."
  },
  {
    "participant_id": "P09",
    "task_type": "lab_website",
    "step_index": 7,
    "decision_and_actions": "The designer decided to remove a rectangle element that was causing layout confusion and replaced it with a text-based logo. They changed the text from '로고' to 'Northbridge Lab' and adjusted the font from 'Inter Regular' to 'Roboto Mono Regular'. The width and height of the text were also adjusted to fit the new font style.",
    "rationale": "",
    "progression": "By removing the rectangle and implementing a text-based logo, the designer streamlined the layout, making it easier to visualize and more aligned with the intended design aesthetic. The font change further enhanced the logo's appearance, contributing to a more cohesive design."
  },
  {
    "participant_id": "P09",
    "task_type": "lab_website",
    "step_index": 8,
    "decision_and_actions": "The designer decided to create a homepage for the lab's website with a more abstract and magazine-like feel, rather than a strictly academic one. To achieve this, they adjusted the dimensions of a rectangle element, increasing its width from 805 to 1280 and its height from 237 to 630. Additionally, they changed the fill color of the rectangle to a slightly darker shade of gray.",
    "rationale": "The rationale behind these decisions was to give the homepage a more modern and visually engaging appearance, similar to an award or product website. This approach aims to make the landing page more appealing and less formal, aligning with the designer's vision of a magazine-like layout that can be easily browsed.",
    "progression": "By resizing the rectangle and adjusting its color, the designer set the foundation for a more expansive and visually striking homepage. This change supports the overall goal of creating a dynamic and engaging user experience, setting the stage for further design elements that will contribute to the magazine-like aesthetic."
  },
  {
    "participant_id": "P09",
    "task_type": "lab_website",
    "step_index": 9,
    "decision_and_actions": "The designer decided to incorporate member photos prominently on the homepage. They created a text element labeled '멤버들 사진' (Member Photos) and adjusted its properties, including changing the font size from 64 to 24 and resizing the text box. The text was positioned centrally to indicate where the photos would be displayed.",
    "rationale": "The rationale behind this decision was to provide visitors with an immediate visual understanding of the lab's members and atmosphere. By using member photos, the designer aimed to convey a sense of the lab's daily life and community, making the site more engaging and relatable.",